{
  "id": "incident-demo",
  "severity": "major",
  "status": "mitigating",
  "summary": "GLB export jobs are failing for one production app.",
  "affectedTeams": ["team-demo"],
  "affectedApps": ["app-demo"],
  "recoveryActions": ["retry_export_jobs", "publish_status_update"],
  "customerImpact": "New model exports are delayed.",
  "detectedAt": "2026-07-09T00:00:00.000Z"
}
